{
  "sema": "zee-morfoloji-conformance-v1",
  "normatif": "RFC-0018/spec-13",
  "profil": {
    "kimlik": "zee-tr-1",
    "sayisal_surum": 1,
    "azami_ek_katmani": 2,
    "uyumluluk_sha256": "e6034e7359e5d5d1bf5f3f06b6a7767616b2b6daf8ab916226b48d522f99f220",
    "ekler": [
      { "kimlik": "belirtme", "yuzeyler": ["yı", "yi", "yu", "yü", "nı", "ni", "nu", "nü", "ı", "i", "u", "ü"] },
      { "kimlik": "iyelik", "yuzeyler": ["sı", "si", "su", "sü", "ı", "i", "u", "ü"] },
      { "kimlik": "tamlayan", "yuzeyler": ["nın", "nin", "nun", "nün", "ın", "in", "un", "ün"] },
      { "kimlik": "yönelme", "yuzeyler": ["ya", "ye", "na", "ne", "a", "e"] },
      { "kimlik": "ayrılma", "yuzeyler": ["ndan", "nden", "dan", "den", "tan", "ten"] },
      { "kimlik": "bulunma", "yuzeyler": ["nda", "nde", "da", "de", "ta", "te"] },
      { "kimlik": "araç", "yuzeyler": ["yla", "yle", "la", "le"] },
      { "kimlik": "çoğul+yönelme", "yuzeyler": ["lara", "lere"] }
    ],
    "gecerli_iki_katman": [
      ["iyelik", "belirtme"],
      ["iyelik", "tamlayan"],
      ["iyelik", "yönelme"],
      ["iyelik", "ayrılma"],
      ["iyelik", "bulunma"],
      ["iyelik", "araç"]
    ]
  },
  "cozum_vakalari": [
    { "kimlik": "tek-belirtme", "yuzey": "elmayı", "kapsam": ["elma"], "yapisal": [{"kok":"elma","ekler":["belirtme"]},{"kok":"elmay","ekler":["belirtme"]}], "karar": {"tur":"kok","deger":"elma"} },
    { "kimlik": "tek-tamlayan", "yuzey": "elmanın", "kapsam": ["elma"], "yapisal": [{"kok":"elma","ekler":["tamlayan"]},{"kok":"elman","ekler":["tamlayan"]}], "karar": {"tur":"kok","deger":"elma"} },
    { "kimlik": "tek-yonelme", "yuzey": "elmaya", "kapsam": ["elma"], "yapisal": [{"kok":"elma","ekler":["yönelme"]},{"kok":"elmay","ekler":["yönelme"]}], "karar": {"tur":"kok","deger":"elma"} },
    { "kimlik": "tek-ayrilma", "yuzey": "elmadan", "kapsam": ["elma"], "yapisal": [{"kok":"elma","ekler":["ayrılma"]}], "karar": {"tur":"kok","deger":"elma"} },
    { "kimlik": "tek-bulunma", "yuzey": "elmada", "kapsam": ["elma"], "yapisal": [{"kok":"elmad","ekler":["yönelme"]},{"kok":"elmat","ekler":["yönelme"]},{"kok":"elma","ekler":["bulunma"]}], "karar": {"tur":"kok","deger":"elma"} },
    { "kimlik": "tek-arac", "yuzey": "elmayla", "kapsam": ["elma"], "yapisal": [{"kok":"elmayl","ekler":["yönelme"]},{"kok":"elmayıl","ekler":["yönelme"]},{"kok":"elma","ekler":["araç"]},{"kok":"elmay","ekler":["araç"]}], "karar": {"tur":"kok","deger":"elma"} },
    { "kimlik": "tek-cogul-yonelme", "yuzey": "elmalara", "kapsam": ["elma"], "yapisal": [{"kok":"elmalar","ekler":["yönelme"]},{"kok":"elma","ekler":["çoğul+yönelme"]}], "karar": {"tur":"kok","deger":"elma"} },
    { "kimlik": "zincir-belirtme", "yuzey": "kitabını", "kapsam": ["kitap"], "yapisal": [{"kok":"kitabı","ekler":["belirtme"]},{"kok":"kitabın","ekler":["belirtme"]},{"kok":"kitab","ekler":["iyelik","belirtme"]},{"kok":"kitap","ekler":["iyelik","belirtme"]}], "karar": {"tur":"kok","deger":"kitap"} },
    { "kimlik": "zincir-tamlayan", "yuzey": "kitabının", "kapsam": ["kitap"], "yapisal": [{"kok":"kitabı","ekler":["tamlayan"]},{"kok":"kitabın","ekler":["tamlayan"]},{"kok":"kitab","ekler":["iyelik","tamlayan"]},{"kok":"kitap","ekler":["iyelik","tamlayan"]}], "karar": {"tur":"kok","deger":"kitap"} },
    { "kimlik": "zincir-yonelme", "yuzey": "kitabına", "kapsam": ["kitap"], "yapisal": [{"kok":"kitabı","ekler":["yönelme"]},{"kok":"kitabın","ekler":["yönelme"]},{"kok":"kitab","ekler":["iyelik","yönelme"]},{"kok":"kitap","ekler":["iyelik","yönelme"]}], "karar": {"tur":"kok","deger":"kitap"} },
    { "kimlik": "zincir-ayrilma", "yuzey": "kitabından", "kapsam": ["kitap"], "yapisal": [{"kok":"kitabı","ekler":["ayrılma"]},{"kok":"kitabın","ekler":["ayrılma"]},{"kok":"kitab","ekler":["iyelik","ayrılma"]},{"kok":"kitap","ekler":["iyelik","ayrılma"]}], "karar": {"tur":"kok","deger":"kitap"} },
    { "kimlik": "zincir-bulunma", "yuzey": "kitabında", "kapsam": ["kitap"], "yapisal": [{"kok":"kitabınd","ekler":["yönelme"]},{"kok":"kitabınt","ekler":["yönelme"]},{"kok":"kitabınıd","ekler":["yönelme"]},{"kok":"kitabı","ekler":["bulunma"]},{"kok":"kitabın","ekler":["bulunma"]},{"kok":"kitab","ekler":["iyelik","bulunma"]},{"kok":"kitap","ekler":["iyelik","bulunma"]}], "karar": {"tur":"kok","deger":"kitap"} },
    { "kimlik": "zincir-arac", "yuzey": "kitabıyla", "kapsam": ["kitap"], "yapisal": [{"kok":"kitabıyl","ekler":["yönelme"]},{"kok":"kitabıyıl","ekler":["yönelme"]},{"kok":"kitabı","ekler":["araç"]},{"kok":"kitabıy","ekler":["araç"]},{"kok":"kitab","ekler":["iyelik","araç"]},{"kok":"kitap","ekler":["iyelik","araç"]}], "karar": {"tur":"kok","deger":"kitap"} },
    { "kimlik": "yumusama-p", "yuzey": "kitabı", "kapsam": ["kitap"], "yapisal": [{"kok":"kitab","ekler":["belirtme"]},{"kok":"kitap","ekler":["belirtme"]}], "karar": {"tur":"kok","deger":"kitap"} },
    { "kimlik": "yumusama-nk", "yuzey": "rengi", "kapsam": ["renk"], "yapisal": [{"kok":"reng","ekler":["belirtme"]},{"kok":"renk","ekler":["belirtme"]},{"kok":"renig","ekler":["belirtme"]}], "karar": {"tur":"kok","deger":"renk"} },
    { "kimlik": "ikizlesme-us", "yuzey": "üssü", "kapsam": ["üs"], "yapisal": [{"kok":"üss","ekler":["belirtme"]},{"kok":"üs","ekler":["belirtme"]},{"kok":"üsüs","ekler":["belirtme"]}], "karar": {"tur":"kok","deger":"üs"} },
    { "kimlik": "ikizlesme-af", "yuzey": "affı", "kapsam": ["af"], "yapisal": [{"kok":"aff","ekler":["belirtme"]},{"kok":"af","ekler":["belirtme"]},{"kok":"afıf","ekler":["belirtme"]}], "karar": {"tur":"kok","deger":"af"} },
    { "kimlik": "ikizlesme-sertlesme-ret", "yuzey": "reddi", "kapsam": ["ret"], "yapisal": [{"kok":"redd","ekler":["belirtme"]},{"kok":"redt","ekler":["belirtme"]},{"kok":"red","ekler":["belirtme"]},{"kok":"ret","ekler":["belirtme"]},{"kok":"redid","ekler":["belirtme"]}], "karar": {"tur":"kok","deger":"ret"} },
    { "kimlik": "ikizlesme-sertlesme-tip", "yuzey": "tıbbı", "kapsam": ["tıp"], "yapisal": [{"kok":"tıbb","ekler":["belirtme"]},{"kok":"tıbp","ekler":["belirtme"]},{"kok":"tıb","ekler":["belirtme"]},{"kok":"tıp","ekler":["belirtme"]},{"kok":"tıbıb","ekler":["belirtme"]}], "karar": {"tur":"kok","deger":"tıp"} },
    { "kimlik": "unlu-dusmesi-sekil", "yuzey": "şekli", "kapsam": ["şekil"], "yapisal": [{"kok":"şekl","ekler":["belirtme"]},{"kok":"şekil","ekler":["belirtme"]}], "karar": {"tur":"kok","deger":"şekil"} },
    { "kimlik": "unlu-dusmesi-burun", "yuzey": "burnu", "kapsam": ["burun"], "yapisal": [{"kok":"bur","ekler":["belirtme"]},{"kok":"burn","ekler":["belirtme"]},{"kok":"burun","ekler":["belirtme"]}], "karar": {"tur":"kok","deger":"burun"} },
    { "kimlik": "unlu-dusmesi-ogul", "yuzey": "oğlu", "kapsam": ["oğul"], "yapisal": [{"kok":"oğl","ekler":["belirtme"]},{"kok":"oğul","ekler":["belirtme"]}], "karar": {"tur":"kok","deger":"oğul"} },
    { "kimlik": "belirsiz-sayac", "yuzey": "sayacı", "kapsam": ["sayac","sayaç"], "yapisal": [{"kok":"sayac","ekler":["belirtme"]},{"kok":"sayaç","ekler":["belirtme"]}], "karar": {"tur":"hata","deger":"A002"} },
    { "kimlik": "dogrudan-eslesme-onceligi", "yuzey": "sayacı", "kapsam": ["sayacı","sayac","sayaç"], "yapisal": [{"kok":"sayac","ekler":["belirtme"]},{"kok":"sayaç","ekler":["belirtme"]}], "karar": {"tur":"kok","deger":"sayacı"} },
    { "kimlik": "belirsiz-pay", "yuzey": "payı", "kapsam": ["pa","pay"], "yapisal": [{"kok":"pa","ekler":["belirtme"]},{"kok":"pay","ekler":["belirtme"]}], "karar": {"tur":"hata","deger":"A002"} },
    { "kimlik": "belirsiz-iki-katman", "yuzey": "zarından", "kapsam": ["zarı","zar"], "yapisal": [{"kok":"zarı","ekler":["ayrılma"]},{"kok":"zarın","ekler":["ayrılma"]},{"kok":"zar","ekler":["iyelik","ayrılma"]}], "karar": {"tur":"hata","deger":"A002"} },
    { "kimlik": "aday-yok", "yuzey": "bilinmeyeni", "kapsam": ["başka"], "yapisal": [{"kok":"bilinmeye","ekler":["belirtme"]},{"kok":"bilinmeyen","ekler":["belirtme"]}], "karar": {"tur":"hata","deger":"A001"} }
  ],
  "uretim_vakalari": [
    {"kimlik":"uret-belirtme","kok":"elma","ekler":["belirtme"],"yuzey":"elmayı"},
    {"kimlik":"uret-tamlayan","kok":"elma","ekler":["tamlayan"],"yuzey":"elmanın"},
    {"kimlik":"uret-yonelme","kok":"elma","ekler":["yönelme"],"yuzey":"elmaya"},
    {"kimlik":"uret-ayrilma","kok":"elma","ekler":["ayrılma"],"yuzey":"elmadan"},
    {"kimlik":"uret-bulunma","kok":"elma","ekler":["bulunma"],"yuzey":"elmada"},
    {"kimlik":"uret-arac","kok":"elma","ekler":["araç"],"yuzey":"elmayla"},
    {"kimlik":"uret-cogul-yonelme","kok":"elma","ekler":["çoğul+yönelme"],"yuzey":"elmalara"},
    {"kimlik":"uret-zincir-belirtme","kok":"kitap","ekler":["iyelik","belirtme"],"yuzey":"kitabını"},
    {"kimlik":"uret-zincir-tamlayan","kok":"kitap","ekler":["iyelik","tamlayan"],"yuzey":"kitabının"},
    {"kimlik":"uret-zincir-yonelme","kok":"kitap","ekler":["iyelik","yönelme"],"yuzey":"kitabına"},
    {"kimlik":"uret-zincir-ayrilma","kok":"kitap","ekler":["iyelik","ayrılma"],"yuzey":"kitabından"},
    {"kimlik":"uret-zincir-bulunma","kok":"kitap","ekler":["iyelik","bulunma"],"yuzey":"kitabında"},
    {"kimlik":"uret-zincir-arac","kok":"kitap","ekler":["iyelik","araç"],"yuzey":"kitabıyla"},
    {"kimlik":"uret-yumusama-c","kok":"ağaç","ekler":["belirtme"],"yuzey":"ağacı"},
    {"kimlik":"uret-yumusama-t","kok":"kanat","ekler":["belirtme"],"yuzey":"kanadı"},
    {"kimlik":"uret-yumusama-k","kok":"çocuk","ekler":["belirtme"],"yuzey":"çocuğu"},
    {"kimlik":"uret-nk-ng","kok":"renk","ekler":["belirtme"],"yuzey":"rengi"},
    {"kimlik":"uret-tek-hece-yumusamaz","kok":"top","ekler":["belirtme"],"yuzey":"topu"},
    {"kimlik":"gecersiz-bos","kok":"fiyat","ekler":[],"yuzey":null},
    {"kimlik":"gecersiz-sira","kok":"fiyat","ekler":["araç","belirtme"],"yuzey":null},
    {"kimlik":"gecersiz-uc-katman","kok":"fiyat","ekler":["iyelik","araç","yönelme"],"yuzey":null}
  ]
}
